<?xml version="1.0"?>
<schema xmlns="http://www.w3.org/2001/XMLSchema"
		targetNamespace="http://cs.skuniv.ac.kr/xml/gaeun"
		xmlns:target="http://cs.skuniv.ac.kr/xml/gaeun"
		elementFormDefault="qualified">
	<group name="AlbumGroup">
		<sequence>
			<element name="Title" type="string"/>
			<element name="Artist" type="string"/>
			<element name="Genre" type="string"/>
			<element name="Released-date" type="string"/>
			<element name="Song" type="string" maxOccurs="unbounded"/>
		</sequence>
	</group>

	<element name="AudioCatalog">
		<complexType>
			<choice  maxOccurs="unbounded">
				<element name="Cd">
					<complexType>
						<group ref="target:AlbumGroup" />
					</complexType>
				</element>
				<element name="Record">
					<complexType>
						<group ref="target:AlbumGroup" />
					</complexType>
				</element>
				<element name="MP3">
					<complexType>
						<group ref="target:AlbumGroup" />
					</complexType>
				</element>
			</choice>
		</complexType>
	</element>

</schema>
